[
  {
    "id": "draft_001",
    "pool": "TECLA",
    "topic": "Sitges",
    "difficulty": 1,
    "questionCa": "Quin color identifica [element o colla concreta] de Sitges?",
    "answerCa": "",
    "reviewStatus": "DRAFT",
    "factualReviewed": false,
    "languageReviewed": false,
    "active": false,
    "sourceType": "requires_tecla_review",
    "notes": "Completar o validar amb la Tecla abans d’aprovar.",
    "contentVersion": 1
  },
  {
    "id": "draft_002",
    "pool": "TECLA",
    "topic": "Sitges",
    "difficulty": 1,
    "questionCa": "Quina peça de roba porta [ball o figura concreta]?",
    "answerCa": "",
    "reviewStatus": "DRAFT",
    "factualReviewed": false,
    "languageReviewed": false,
    "active": false,
    "sourceType": "requires_tecla_review",
    "notes": "Completar o validar amb la Tecla abans d’aprovar.",
    "contentVersion": 1
  },
  {
    "id": "draft_003",
    "pool": "TECLA",
    "topic": "Sitges",
    "difficulty": 1,
    "questionCa": "Com s’anomena [figura festiva concreta] de Sitges?",
    "answerCa": "",
    "reviewStatus": "DRAFT",
    "factualReviewed": false,
    "languageReviewed": false,
    "active": false,
    "sourceType": "requires_tecla_review",
    "notes": "Completar o validar amb la Tecla abans d’aprovar.",
    "contentVersion": 1
  },
  {
    "id": "draft_004",
    "pool": "TECLA",
    "topic": "Sitges",
    "difficulty": 1,
    "questionCa": "Quin instrument acompanya [ball concret] de Sitges?",
    "answerCa": "",
    "reviewStatus": "DRAFT",
    "factualReviewed": false,
    "languageReviewed": false,
    "active": false,
    "sourceType": "requires_tecla_review",
    "notes": "Completar o validar amb la Tecla abans d’aprovar.",
    "contentVersion": 1
  },
  {
    "id": "draft_005",
    "pool": "PAU_TECLA",
    "topic": "Sitges fàcil",
    "difficulty": 1,
    "questionCa": "Quin element de la Festa Major prefereix la Tecla?",
    "answerCa": "",
    "reviewStatus": "DRAFT",
    "factualReviewed": false,
    "languageReviewed": false,
    "active": false,
    "sourceType": "requires_tecla_review",
    "notes": "Completar o validar amb la Tecla abans d’aprovar.",
    "contentVersion": 1
  },
  {
    "id": "draft_006",
    "pool": "PAU_TECLA",
    "topic": "Personal",
    "difficulty": 1,
    "questionCa": "Quina cançó coral recorda especialment la Tecla?",
    "answerCa": "",
    "reviewStatus": "DRAFT",
    "factualReviewed": false,
    "languageReviewed": false,
    "active": false,
    "sourceType": "requires_tecla_review",
    "notes": "Completar o validar amb la Tecla abans d’aprovar.",
    "contentVersion": 1
  },
  {
    "id": "draft_007",
    "pool": "TECLA_PAU",
    "topic": "Personal",
    "difficulty": 1,
    "questionCa": "Quin lloc voldria visitar en Pau per la seva geografia?",
    "answerCa": "",
    "reviewStatus": "DRAFT",
    "factualReviewed": false,
    "languageReviewed": false,
    "active": false,
    "sourceType": "requires_tecla_review",
    "notes": "Completar o validar amb la Tecla abans d’aprovar.",
    "contentVersion": 1
  },
  {
    "id": "draft_008",
    "pool": "TECLA_PAU",
    "topic": "Personal",
    "difficulty": 1,
    "questionCa": "Quin atleta admira especialment en Pau?",
    "answerCa": "",
    "reviewStatus": "DRAFT",
    "factualReviewed": false,
    "languageReviewed": false,
    "active": false,
    "sourceType": "requires_tecla_review",
    "notes": "Completar o validar amb la Tecla abans d’aprovar.",
    "contentVersion": 1
  },
  {
    "id": "draft_009",
    "pool": "PAU",
    "topic": "Personal",
    "difficulty": 1,
    "questionCa": "Quina és la marca personal actual d’en Pau als 800 metres?",
    "answerCa": "",
    "reviewStatus": "DRAFT",
    "factualReviewed": false,
    "languageReviewed": false,
    "active": false,
    "sourceType": "requires_tecla_review",
    "notes": "Completar o validar amb la Tecla abans d’aprovar.",
    "contentVersion": 1
  },
  {
    "id": "draft_010",
    "pool": "TECLA",
    "topic": "Personal",
    "difficulty": 1,
    "questionCa": "Quina peça ha gaudit més cantant la Tecla?",
    "answerCa": "",
    "reviewStatus": "DRAFT",
    "factualReviewed": false,
    "languageReviewed": false,
    "active": false,
    "sourceType": "requires_tecla_review",
    "notes": "Completar o validar amb la Tecla abans d’aprovar.",
    "contentVersion": 1
  },
  {
    "id": "draft_011",
    "pool": "TP",
    "topic": "Records compartits",
    "difficulty": 1,
    "questionCa": "On vau fer [record compartit]?",
    "answerCa": "",
    "reviewStatus": "DRAFT",
    "factualReviewed": false,
    "languageReviewed": false,
    "active": false,
    "sourceType": "requires_tecla_review",
    "notes": "Completar o validar amb la Tecla abans d’aprovar.",
    "contentVersion": 1
  },
  {
    "id": "draft_012",
    "pool": "TP",
    "topic": "Records compartits",
    "difficulty": 1,
    "questionCa": "Quin va ser el primer [record compartit]?",
    "answerCa": "",
    "reviewStatus": "DRAFT",
    "factualReviewed": false,
    "languageReviewed": false,
    "active": false,
    "sourceType": "requires_tecla_review",
    "notes": "Completar o validar amb la Tecla abans d’aprovar.",
    "contentVersion": 1
  }
]